{
  "$schema": "https://json-schema.org/draft/2020-12/schema",
  "$id": "https://aid-orchestrator/schemas/test-parallel-pilot-v1",
  "title": "aid-test-parallel-pilot-v1",
  "description": "The receipt from running one candidate lane both serially and concurrently in a disposable clone. It PROPOSES; it never writes the catalog, execution.yaml, or a scheduler mode. A promotion that is refused records the refusal — an absence would read as 'never tried'.",
  "type": "object",
  "additionalProperties": false,
  "required": [
    "schema_version",
    "lane_id",
    "membership",
    "workers",
    "repeat",
    "promotion",
    "reason",
    "repetitions",
    "benefit_ms",
    "noise_threshold_ms",
    "target_root",
    "audit_id",
    "parallelism"
  ],
  "properties": {
    "schema_version": {
      "const": "aid-test-parallel-pilot-v1"
    },
    "lane_id": {
      "type": "string",
      "minLength": 1
    },
    "audit_id": {
      "type": [
        "string",
        "null"
      ]
    },
    "target_root": {
      "description": "The disposable clone this ran in. Recorded so a reader can confirm it was not the live checkout.",
      "type": "string",
      "minLength": 1
    },
    "membership": {
      "description": "The exact run units piloted, sorted. A lane may only be promoted on evidence gathered for its OWN membership — this is what makes that checkable.",
      "type": "array",
      "minItems": 1,
      "items": {
        "type": "string",
        "minLength": 1
      }
    },
    "membership_sha256": {
      "type": "string",
      "pattern": "^[0-9a-f]{64}$"
    },
    "workers": {
      "type": "integer",
      "minimum": 2
    },
    "repeat": {
      "type": "integer",
      "minimum": 1
    },
    "promotion": {
      "description": "`proposed` means every repetition satisfied every criterion AND the measured benefit exceeded noise. `safe_not_worthwhile` means it was safe but not faster. `refused` means a criterion failed — and failure keeps units serial rather than being retried until green.",
      "type": "string",
      "enum": [
        "proposed",
        "safe_not_worthwhile",
        "refused"
      ]
    },
    "reason": {
      "type": "string",
      "minLength": 10
    },
    "benefit_ms": {
      "description": "Serial duration minus parallel duration, from the slowest repetition of each. Null when no repetition completed both runs.",
      "type": [
        "integer",
        "null"
      ]
    },
    "noise_threshold_ms": {
      "type": "integer",
      "minimum": 0
    },
    "failing_repetition": {
      "description": "1-based index of the first repetition that failed a criterion. Present exactly when promotion is `refused` for a per-repetition reason.",
      "type": [
        "integer",
        "null"
      ],
      "minimum": 1
    },
    "repetitions": {
      "type": "array",
      "items": {
        "$ref": "#/$defs/repetition"
      }
    },
    "parallelism": {
      "description": "Whether the runner could actually run cases concurrently. Bats delegates --jobs to GNU parallel; without it the flag degrades to serial, and a verdict drawn from that would describe a comparison that never happened.",
      "type": "object",
      "additionalProperties": false,
      "required": [
        "available",
        "note"
      ],
      "properties": {
        "available": {
          "type": "boolean"
        },
        "note": {
          "type": "string",
          "minLength": 10
        }
      }
    }
  },
  "$defs": {
    "run": {
      "type": "object",
      "additionalProperties": false,
      "required": [
        "duration_ms",
        "exit_code",
        "job_state",
        "results"
      ],
      "properties": {
        "duration_ms": {
          "type": "integer",
          "minimum": 0
        },
        "exit_code": {
          "type": "integer"
        },
        "job_state": {
          "type": "string"
        },
        "results": {
          "description": "Per-case outcomes, ordered. The comparison is over THIS, not over the aggregate verdict: a skip turning into a pass leaves the aggregate unchanged while changing what was actually verified.",
          "type": "array",
          "items": {
            "type": "object",
            "additionalProperties": false,
            "required": [
              "name",
              "status"
            ],
            "properties": {
              "name": {
                "type": "string"
              },
              "status": {
                "type": "string",
                "enum": [
                  "passed",
                  "failed",
                  "skipped"
                ]
              }
            }
          }
        },
        "dirty_paths": {
          "description": "`git status --short` in the disposable root after the run. Non-empty means the run mutated tracked state, which no test lane may do.",
          "type": "array",
          "items": {
            "type": "string"
          }
        },
        "escaped_paths": {
          "description": "Entries that appeared beside the disposable root, from a pre-run/post-run inventory of its parent. A write outside the declared root is the failure mode a clone cannot contain.",
          "type": "array",
          "items": {
            "type": "string"
          }
        }
      }
    },
    "repetition": {
      "type": "object",
      "additionalProperties": false,
      "required": [
        "index",
        "serial",
        "parallel",
        "verdict"
      ],
      "properties": {
        "index": {
          "type": "integer",
          "minimum": 1
        },
        "serial": {
          "$ref": "#/$defs/run"
        },
        "parallel": {
          "$ref": "#/$defs/run"
        },
        "verdict": {
          "type": "string",
          "enum": [
            "match",
            "mismatch"
          ]
        },
        "differences": {
          "description": "Named, never counted. 'three cases differed' sends nobody anywhere.",
          "type": "array",
          "items": {
            "type": "string"
          }
        }
      }
    }
  },
  "allOf": [
    {
      "$comment": "A proposal must rest on a measured benefit. Without one there is nothing to weigh against the risk of concurrency.",
      "if": {
        "properties": {
          "promotion": {
            "const": "proposed"
          }
        },
        "required": [
          "promotion"
        ]
      },
      "then": {
        "properties": {
          "benefit_ms": {
            "type": "integer"
          }
        }
      }
    },
    {
      "$comment": "A refusal names which repetition failed, when the failure was per-repetition. A refusal with no locus is a verdict nobody can act on.",
      "if": {
        "properties": {
          "promotion": {
            "const": "refused"
          }
        },
        "required": [
          "promotion"
        ]
      },
      "then": {
        "required": [
          "failing_repetition"
        ]
      }
    },
    {
      "$comment": "Nothing may be proposed when concurrency was unavailable: there was no concurrent run to draw a conclusion from.",
      "if": {
        "properties": {
          "parallelism": {
            "properties": {
              "available": {
                "const": false
              }
            },
            "required": [
              "available"
            ]
          }
        },
        "required": [
          "parallelism"
        ]
      },
      "then": {
        "properties": {
          "promotion": {
            "const": "refused"
          }
        }
      }
    }
  ]
}
