{"schema_version":"aid-test-parallel-pilot-v1","lane_id":"representative-lane","audit_id":"dogfood-1","target_root":"/tmp/claude-1000/-opt-eco-projects-aid-orchestrator/fceea7f1-bc28-44a6-8212-974e4b4cda61/scratchpad/lane-clone","membership":["bats:plugins/aid-orchestrator/scripts/tests/bats/test-aid-epic-summary","bats:plugins/aid-orchestrator/scripts/tests/bats/test-aid-gate-runtime-report","bats:plugins/aid-orchestrator/scripts/tests/bats/test-aid-gitignore-backfill","bats:plugins/aid-orchestrator/scripts/tests/bats/test-delivery-report"],"membership_sha256":"2513b631d30754fb3c4c464732d9f20c8ddce437ec064a74064f4bf0dfe5b221","workers":4,"repeat":2,"promotion":"proposed","reason":"all 2 repetition(s) matched per case, the clone stayed clean, and the concurrent run was 12944ms faster (serial 29200ms vs parallel 16256ms at 4 workers)","benefit_ms":12944,"noise_threshold_ms":2000,"failing_repetition":null,"repetitions":[{"index":1,"serial":{"duration_ms":29197,"exit_code":0,"job_state":"terminal_pass","results":[{"name":"generate: epic-summary.md exists with all 5 required section headers","status":"passed"},{"name":"generate: fsm_force_override event in timeline → warnings section mentions it","status":"passed"},{"name":"edge case 1: --project-root with no .aid-o/ at all -> clear error, exit non-zero","status":"passed"},{"name":"error handling: valid project root but no baseline file yet -> 'no data yet', exit 0","status":"passed"},{"name":"error handling: gate_name given but never run -> 'no data yet' style message, exit 0","status":"passed"},{"name":"edge case 2: no arguments from a valid project root lists every gate with >=1 sample","status":"passed"},{"name":"edge case 3: gate with only censored (timeout) samples reports data-insufficient, never derives a value from timeouts","status":"passed"},{"name":"AC14: --project-root from an unrelated cwd matches running directly from that path","status":"passed"},{"name":"AC14: --project-root from an unrelated cwd matches direct cd for the full gate list (no gate_name)","status":"passed"},{"name":"sufficient data: gate with >=3 non-censored samples reports recommendation available","status":"passed"},{"name":"insufficient data: gate with only 2 non-censored samples reports recommendation not yet available with real count","status":"passed"},{"name":"usage: -h/--help prints usage and exits non-zero","status":"passed"},{"name":"usage: unknown flag prints usage and exits non-zero","status":"passed"},{"name":"usage: --project-root missing its argument prints usage and exits non-zero","status":"passed"},{"name":"has_entry: file does not exist -> false","status":"passed"},{"name":"has_entry (.gitignore-style fixture): entry present -> true","status":"passed"},{"name":"has_entry (.gitignore-style fixture): entry absent among unrelated lines -> false","status":"passed"},{"name":"has_entry (.git/info/exclude-style fixture): entry present -> true","status":"passed"},{"name":"has_entry: exact-line match only — a substring/prefix does NOT count as present","status":"passed"},{"name":"append (.gitignore-style): file absent -> created with parent dir, entry written","status":"passed"},{"name":"append (.git/info/exclude-style): file absent -> created on demand (edge case 5)","status":"passed"},{"name":"append: hand-edited unrelated lines are preserved, entry only appended at EOF (edge case 2)","status":"passed"},{"name":"append: running twice is idempotent — no duplicate line (edge case 3)","status":"passed"},{"name":"append: two different entries against the same file both land, in call order","status":"passed"},{"name":"AC9: first baseline write in an existing (already-initialized) project backfills .git/info/exclude, never touches tracked .gitignore","status":"passed"},{"name":"AC9: .git/info/exclude doesn't exist yet in this clone -> created on demand (edge case 5, real repo)","status":"passed"},{"name":"AC9: second run is idempotent — no duplicate .git/info/exclude lines, no reordering of hand-edited entries","status":"passed"},{"name":"AC9: already-gitignored via tracked .gitignore -> bootstrap never touches .git/info/exclude at all","status":"passed"},{"name":"AID_GATE_BASELINE_FILE override (test isolation) -> run-all never touches git state at all","status":"passed"},{"name":"AC9: brand-new project fixture — shipped defaults/.gitignore already contains .aid-o/metrics/","status":"passed"},{"name":"null before plan boundary (no ca-review-complete marker)","status":"passed"},{"name":"true at boundary: report present + _test_evidence file exists on disk","status":"passed"},{"name":"false at boundary: report absent","status":"passed"},{"name":"false at boundary: _test_evidence references a file missing on disk","status":"passed"},{"name":"true: frontmatter directly at boundary (no leading HTML comment)","status":"passed"},{"name":"false: _test_evidence path-traversal/absolute path is rejected (CP3 security hardening)","status":"passed"}],"dirty_paths":[],"escaped_paths":[]},"parallel":{"duration_ms":14105,"exit_code":0,"job_state":"terminal_pass","results":[{"name":"generate: epic-summary.md exists with all 5 required section headers","status":"passed"},{"name":"generate: fsm_force_override event in timeline → warnings section mentions it","status":"passed"},{"name":"edge case 1: --project-root with no .aid-o/ at all -> clear error, exit non-zero","status":"passed"},{"name":"error handling: valid project root but no baseline file yet -> 'no data yet', exit 0","status":"passed"},{"name":"error handling: gate_name given but never run -> 'no data yet' style message, exit 0","status":"passed"},{"name":"edge case 2: no arguments from a valid project root lists every gate with >=1 sample","status":"passed"},{"name":"edge case 3: gate with only censored (timeout) samples reports data-insufficient, never derives a value from timeouts","status":"passed"},{"name":"AC14: --project-root from an unrelated cwd matches running directly from that path","status":"passed"},{"name":"AC14: --project-root from an unrelated cwd matches direct cd for the full gate list (no gate_name)","status":"passed"},{"name":"sufficient data: gate with >=3 non-censored samples reports recommendation available","status":"passed"},{"name":"insufficient data: gate with only 2 non-censored samples reports recommendation not yet available with real count","status":"passed"},{"name":"usage: -h/--help prints usage and exits non-zero","status":"passed"},{"name":"usage: unknown flag prints usage and exits non-zero","status":"passed"},{"name":"usage: --project-root missing its argument prints usage and exits non-zero","status":"passed"},{"name":"has_entry: file does not exist -> false","status":"passed"},{"name":"has_entry (.gitignore-style fixture): entry present -> true","status":"passed"},{"name":"has_entry (.gitignore-style fixture): entry absent among unrelated lines -> false","status":"passed"},{"name":"has_entry (.git/info/exclude-style fixture): entry present -> true","status":"passed"},{"name":"has_entry: exact-line match only — a substring/prefix does NOT count as present","status":"passed"},{"name":"append (.gitignore-style): file absent -> created with parent dir, entry written","status":"passed"},{"name":"append (.git/info/exclude-style): file absent -> created on demand (edge case 5)","status":"passed"},{"name":"append: hand-edited unrelated lines are preserved, entry only appended at EOF (edge case 2)","status":"passed"},{"name":"append: running twice is idempotent — no duplicate line (edge case 3)","status":"passed"},{"name":"append: two different entries against the same file both land, in call order","status":"passed"},{"name":"AC9: first baseline write in an existing (already-initialized) project backfills .git/info/exclude, never touches tracked .gitignore","status":"passed"},{"name":"AC9: .git/info/exclude doesn't exist yet in this clone -> created on demand (edge case 5, real repo)","status":"passed"},{"name":"AC9: second run is idempotent — no duplicate .git/info/exclude lines, no reordering of hand-edited entries","status":"passed"},{"name":"AC9: already-gitignored via tracked .gitignore -> bootstrap never touches .git/info/exclude at all","status":"passed"},{"name":"AID_GATE_BASELINE_FILE override (test isolation) -> run-all never touches git state at all","status":"passed"},{"name":"AC9: brand-new project fixture — shipped defaults/.gitignore already contains .aid-o/metrics/","status":"passed"},{"name":"null before plan boundary (no ca-review-complete marker)","status":"passed"},{"name":"true at boundary: report present + _test_evidence file exists on disk","status":"passed"},{"name":"false at boundary: report absent","status":"passed"},{"name":"false at boundary: _test_evidence references a file missing on disk","status":"passed"},{"name":"true: frontmatter directly at boundary (no leading HTML comment)","status":"passed"},{"name":"false: _test_evidence path-traversal/absolute path is rejected (CP3 security hardening)","status":"passed"}],"dirty_paths":[],"escaped_paths":[]},"verdict":"match","differences":[]},{"index":2,"serial":{"duration_ms":29200,"exit_code":0,"job_state":"terminal_pass","results":[{"name":"generate: epic-summary.md exists with all 5 required section headers","status":"passed"},{"name":"generate: fsm_force_override event in timeline → warnings section mentions it","status":"passed"},{"name":"edge case 1: --project-root with no .aid-o/ at all -> clear error, exit non-zero","status":"passed"},{"name":"error handling: valid project root but no baseline file yet -> 'no data yet', exit 0","status":"passed"},{"name":"error handling: gate_name given but never run -> 'no data yet' style message, exit 0","status":"passed"},{"name":"edge case 2: no arguments from a valid project root lists every gate with >=1 sample","status":"passed"},{"name":"edge case 3: gate with only censored (timeout) samples reports data-insufficient, never derives a value from timeouts","status":"passed"},{"n